STT,Mã học phần,Tên học phần,Tín chỉ,Loại môn học,Điểm,Điểm chữ,Kết quả,Chi tiết
 1, 1711MILI2402, Công tác quốc phòng và an ninh, 2, Bắt Buộc, 4.00, Ð, ,Chi tiết
 2, 1711ENGL1406, Đọc - Viết 1, 3, Bắt Buộc, 3.00, B, ,Chi tiết
 3, 1711MILI2401, Đường lối quốc phòng và an ninh của Đảng Cộng sản Việt Nam, 2, Bắt Buộc, 4.00, Ð, ,Chi tiết
 4, 1711PHYL2401, Giáo dục thể chất 1 (Thể dục - Điền kinh), 1, Bắt Buộc, 4.00, A, ,Chi tiết
 5, 1711ENGL1401, Nghe - Nói 1, 3, Bắt Buộc, 3.50, B+, ,Chi tiết
 6, 1711POLI1001, Những nguyên lý cơ bản của chủ nghĩa Mác – Lênin, 5, Bắt Buộc, 2.00, C, ,Chi tiết
