STT,Mã học phần,Tên học phần,Tín chỉ,Loại môn học,Điểm,Điểm chữ,Kết quả,Chi tiết
 1, 1711MILI2402, Công tác quốc phòng và an ninh, 2, Bắt Buộc, , , ,Chi tiết
 2, 1711FRAN1011, Đọc viết cơ sở, 4, Bắt Buộc, , , ,Chi tiết
 3, 1711MILI2401, Đường lối quốc phòng và an ninh của Đảng Cộng sản Việt Nam, 2, Bắt Buộc, , , ,Chi tiết
 4, 1711PHYL2401, Giáo dục thể chất 1 (Thể dục - Điền kinh), 1, Tự Chọn, 0.00, F, ,Chi tiết
 5, 1711FRAN1001, Nghe nói cơ sở, 4, Bắt Buộc, , , ,Chi tiết
 6, 1711EDUC1400, Nhập môn nghề giáo, 1, Bắt Buộc, , , ,Chi tiết
 7, 1711POLI1001, Những nguyên lý cơ bản của chủ nghĩa Mác – Lênin, 5, Bắt Buộc, , , ,Chi tiết
 8, 1711PSYC1001, Tâm lý học đại cương, 2, Bắt Buộc, , , ,Chi tiết
 9, 1711TTTH1001, Tin học căn bản, 3, Bắt Buộc, 0.00, F, ,Chi tiết
