STT,Mã học phần,Tên học phần,Tín chỉ,Loại môn học,Điểm,Điểm chữ,Kết quả,Chi tiết
 1, 1811ENGL1406, Đọc - Viết 1, 3, Bắt Buộc, , , ,Chi tiết
 2, 1811MILI2401, Đường lối quốc phòng và an ninh của Đảng Cộng sản Việt Nam, 2, Bắt Buộc, , , ,Chi tiết
 3, 1811PHYL2401, Giáo dục thể chất 1 (Thể dục - Điền kinh), 1, Bắt Buộc, 0.00, F, ,Chi tiết
 4, 1811ENGL1401, Nghe - Nói 1, 3, Bắt Buộc, , , ,Chi tiết
 5, 1811EDUC1400, Nhập môn nghề giáo, 1, Bắt Buộc, , , ,Chi tiết
 6, 1811POLI1001, Những nguyên lý cơ bản của chủ nghĩa Mác – Lênin, 5, Bắt Buộc, , , ,Chi tiết
 7, 1811PSYC1001, Tâm lý học đại cương, 2, Bắt Buộc, , , ,Chi tiết
 8, 1811TTTH1001, Tin học căn bản, 3, Bắt Buộc, 0.00, F, ,Chi tiết
