STT,Mã học phần,Tên học phần,Tín chỉ,Loại môn học,Điểm,Điểm chữ,Kết quả,Chi tiết
 1, 2011MATH1402, Đại số tuyến tính 1, 3, Bắt Buộc, , , ,Chi tiết
 2, 2011MATH1403, Giải tích hàm một biến, 4, Bắt Buộc, , , ,Chi tiết
 3, 2011PHYL2401, Giáo dục thể chất 1 (Thể dục - Điền kinh), 1, Tự Chọn, 0.00, F, ,Chi tiết
 4, 2011MATH1405, Hình học giải tích, 2, Bắt Buộc, , , ,Chi tiết
 5, 2011EDUC1400, Nhập môn nghề giáo, 1, Bắt Buộc, , , ,Chi tiết
 6, 2011POLI1903, Pháp luật đại cương, 2, Bắt Buộc, , , ,Chi tiết
 7, 2011MATH1700, Phương pháp nghiên cứu khoa học Giáo dục môn Toán, 2, Bắt Buộc, , , ,Chi tiết
 8, 2011PSYC1001, Tâm lý học đại cương, 2, Bắt Buộc, , , ,Chi tiết
 9, 2011POLI2001, Triết học Mác – Lênin, 3, Bắt Buộc, , , ,Chi tiết
